title,poem,tags,is_love_poem,decade
Fødselsdagsdikt,"Slik just jeg mins dig

fra ungdommens tid:

Storraadig, selvglad,

tidt lysten paa strid,

eggende blodvarm

ved mændees stevne,

fuldrik paa skjønhet,

end mere paa evne.



Dog mot hver den, som

hos dig søkte vern,

dronninggod øm og

beskyttende fjern.

Husker, jeg tænkte

En sagaens kvinde

er det, hun ligner,

dypt farlig at vinde.



Burde med hærmænd

hver kveld peliet raad,

dristig dem egget

til elskov og daad . . .

Intet at undre

sig paa, om ved siden

av dig hver elsker

blev fattig og liten.



Paa hvad du gav dem,

vandt makt de og ry.

 bare tapte

og tapte paany.

Hver gang dit hjerte

du aapnet, saa trængte

spydsodden ind, hvor

dets krater den sprængte.



Hvorfor? Saa tidt har

jeg lett efter svar:

Kanske for ursterk

og mæktig du var.

Just for at redde

sig oprør de gjorde

mot, hvad i dig er

det blinde og store.



Tiden, jo heter

det, læger hvert saar.

Helte den ,

blev skorpen dog haard.

Ind under verket

i ufred og brændte

vildt trods dit hovmod

dog skammen, du kjendte.



Vikingkvinde

med vikingehu

sitter i skyggen

du graahaaret nu?

Hvas er din tunge,

end hvassere øiet.

Trampet og sveket,

ei blev dog bøiet.



Dagstrøtt du verner

dig gods med forstand

vækkes dog stundom

av vundernes brand,

længter mot elskov,

mot favntakets hete,

husker din alder

og blusser av vrede.



Ser saa en ungmø

du svæve avsted

let henad jorden

med sorgløse fjed,

mins du den krigsplikt,

 fuldbringe maatte:

Hjerteblod kostet

hvert skridt som du traadte.



Vikingekvinde,

da mørkner dit blik:

Mænd, vil I vite

den vei, som du gik,

følg da det blodspor,

fra vuggen jeg levnet,

stans først i graven

og se, hvad jeg evnet!","Et liv i dikt, Nils Collett Vogt, Alle dikt alfabetisk, Dikt skrevet på 1900-tallet, Bursdag",0,1900
Ting og greier av meg Då!,"Dytt henne hardere 

Spark henne hardere 

Slå henne hardere 

Spytt mer på henne 

Le mer av henne 

Få hun enda mer lei seg 

Fortell hvor dårlig hun er 

Si at hun ikke er god nok 





Jeg hater livet 

Jeg hater folkene  

Jeg hater skolen med dem 

Jeg prøver å være sterk 

Jeg prøver å ikke gråte  

Jeg prøver å være normal 

Jeg prøver å leve 

Jeg prøver å komme meg hjem 



 

Vi ser hun prøver å være sterk 

Vi ser hun prøver å få venner 

Vi ser hun gjør sitt beste med det hun har 

Vi ser alle blå merkene 

Vi ser alle skadene 

Vi ser alle skrapene 

Vi ser hun vil ikke mer","Mobbing, Jo4kimR, Alle dikt alfabetisk, Dikt skrevet på 2000-tallet",0,2000
Arbeidsløs jul,"Vi som er dømt til livet

i gråbeingårdenes by

feirer i dag en solfest

for ham, som er født på ny.



Vi har fått tyve kroner

å feire hans komme med!

For dem har vi kjøpt en julegran

og en hel sekk ved.



For dem har vi kjøpt en bayer

og et stykke hestekjøtt.

Det siste skal minne om stallen

hvor frelseren blev født. 



De fattiges herre og mester!

Det var ikke godt for ham.

Han hengtes til slutt på korset

midt mellom synd og skam.



Godt det er bare en skrøne

at Kristus er kommet påny.

Så blir det en fattig mindre

å nagle på kors i vår by.



Vi i de mørke gater

feirer i dag en fest.

Til jul får vi tyve kroner,

til påske: Korsfest! Korsfest!","På stengrunn, Rudolf Nilsen, Dikt skrevet på 1900-tallet, Alle dikt alfabetisk, Jul",0,1900
Jeg elsker deg,"Jeg elsker deg, du er så ærlig

Jeg elsker deg, du er deg selv

Jeg elsker deg, du smiler alltid

Jeg elsker deg, du er så vennlig

Jeg elsker deg, du er smart

Jeg elsker deg, du tenker på andre

Jeg elsker deg, elsker du meg?","Fantasien, Kjærlighet, Alle dikt alfabetisk, Dikt skrevet på 2000-tallet",1,2000
Johan Sverdrup,"Det unge Norge samled sig i Leir,

det fylked sig og slog, til det vandt Seir.

Der vaiede et Banner over Leiren,

i Stridens haarde Dyst og over Seiren.

        Og det var Johan Sverdrups Navn.



En rastløs Arbeidsaand, en Sjæl i Brand,

en Tolk, en Fører for sit Folk og Land,

- til Alderdommen kom, af Stormvind baaret,

og dryssed ham sit hvidgraa Rim i Haaret

        og hylled sig omkring hans Navn.



Men Manden var for stor, hans Navn for stort

til at bli glemt ved slig at dølges bort.

Han var saa stor, at han ei  bli liden.

Han selv er borte, - vokse vil med Tiden

        dog endnu Johan Sverdrups Navn.



Og staar det unge Norge ei idag

med blottet Hoved og med sænket Flag,

da er det Norge selv, som saadan lønner,

at det har ingen Ret til store Sønner.

        - Men Fred med Johan Sverdrups Navn!","Per Sivle, Begravelse, Skaldemaal, Alle dikt alfabetisk, Dikt skrevet på 1800-tallet",0,1800
Minne.,"er var ei Gong ei fager Tid,

daa Barneaar til Ungdom vaara,

daa Lauv og Blomar kunde daara,

daa alting enn var Poesi.



Der var ei Gong ei fager Tid,

eg laag paa blanke Fjord og vogga,

med Barmen full, med Auga dogga,

med' store Syner gleid forbi.



Den Tid daa endaa Ysma dylgde

baad' kvasse Kantar og Avgrunnar,

daa varme Ord fraa friske Munnar

paa all mi Ferd meg kjærleg fylgde.



Den Tid daa endaa ei mi Kraft

var melt i Livsens Strid og Sut,

daa aldri Sorg eg hadde havt,

som ikkje kunde graatast ut.



Men Aari gaar, og mangt ein møter,

som brigder det ein hever tenkt;

ein fær paa Ferdi saare Føter,

og faa naar Maale for sin Lengt.","Alle dikt alfabetisk, Dikt skrevet på 1800-tallet, Lars Jaastad, Dikt på nynorsk, Nynorsk",0,1800
Venner for livet,"Lyttende ører

et smil som forstår

gir lettere bører

leger sjelens sår



Tanker som deles

en hjelpende hånd

sorger som kveles

av vennskapets bånd



Smil blir til tårer

og tårer til smil

sannhet som sårer

men fjerner all tvil



Evig fortrolighet

i riktig og galt

et vennskap med ærlighet

tåler jo alt","Vennskap, Dikt skrevet på 2000-tallet, Ekteskap, Alle dikt alfabetisk",0,2000
Kunne ønske jeg hadde reddet deg,"Det som en gang var to 

Var blitt en



Det som en gang var to bestevenner 

Var blitt en enslig tanke



Det som en gang var to vakre og håpefulle drømmer 

Var blitt et forferdelig mareritt 



Den eneste tanken 

Var at det var min feil





Det var min feil

Jeg kunne reddet

Men gjorde ikke



En liten kule gjennom hodet

Og alt er over

Ingen lidelser  

Ingen sorg



En liten fingerbevegelse

Og alt er over





Avtrekkeren gikk sakte innover 

Kulen skrek

og alt var over



Ingen flere følelser 

Ingen flere lidelser

ingenting","Vennskap, Alle dikt alfabetisk, Dikt skrevet på 2000-tallet",0,2000
Vaardag,"Aa nei, for Himil rein og klaar!

Aa sæle meg, no er det Vaar!

No spelar Liv um Land og Strand;

aa sæle meg, at upp eg vann!



Aa nei, for Dag vaar Herre gav!

So skirt um Fjell, so svalt i Hav!

So linn ei Luft, so høgt um Haug!

Og dette sæle Solskinslaug!



Aa nei, eg høyrer Lerka slaa

upp under bleike Himilblaa;

mot Kvelv ho stig med Songen sin;

snart naar ho visst i Himlen inn.



Sjaa Maaken ror fraa klaare Nut

i stille Tak mot Have ut;

og Fugl det kvitrar, kved og syng

i Tun og Tre, i Lund og Lyng.



Og aa, som Soli lognar trygg

som Varmeflaum um Barm og Rygg!



Og gjenom all den milde Dag,

det mjuke, salte Havsens Drag!



Det brydder Straa, det sveller Knupp,

og Sevja stig i Trée upp;

ein Daam det vaknar søt og tung . . .

Aa sæle meg som er so ung!","Vår, Haugtussa, Arne Garborg, Dikt skrevet på 1800-tallet, Alle dikt alfabetisk",0,1800
Lærer,"Den beste læreren er også den beste personen, 

uansett så er læreren best","Alle dikt alfabetisk, Dikt skrevet på 2000-tallet, Korte dikt",0,2000
Guldkorn 0004,"Det himmelske er der ved kjærlighed,

at dens sorg selv bliver et rigdoms væld:

hvor fyldes mig ei mangen ensom kveld,

naar jeg sænker mig i min erindring ned.","Peter Andreas Munch, Johan Sebastian Welhaven, Guldkorn",0,0
Livets musikk,"Din hånd 

rører mitt hjerte 

maseres med glede 

slik at rytmen bevares



Din sjel

legger ro i kroppen 

livet er balansert 

mellom gode og onde



Din glede 

sprer tårer av lykke

humøret den smittes 

det onde forsvinner



Livet er lett

i ditt nærvær

du er fremtiden

og min kjære","Ksk, Dikt skrevet på 2000-tallet, Kjærlighet, Alle dikt alfabetisk",1,2000
Falsktvennskap,"Venner ja, hva kan en si om dem?

Mange er gode, virkelig gode, men 

Mange er også dårlige. Det er dessverre

De dårlige vi ser lettest. De er de som 

Svikter, forlater deg, ser stygt på deg,

Snakker bak din rygg, selsom du bare er deg.

Du sitter der, håper og tror de en dag vil innse 

At det de gjør er grusomt. Du venter og venter,

Flere uker går det, før du først da, innser at de vennene

Du engang hadde, er borte for alltid. 

Årene går, og du ser de komme krypende til deg for

Tilgivelse. Du føler at tilgivelse er det eneste 

Rette.

 Dessverre for dem, kom hjernen i forkjøpet.","Alle dikt alfabetisk, Vennskap",0,0
Rakettene suser,"Rakettene suser

og glassene bruser

Et nytt år skal komme

det gamle er omme



Vi hever vårt glass

og tenner raketter

vi skåler i sjampis

og nyttårs forsetter



Et nytt år skal komme

vi hilser det frem

Det gamle er omme

og vinker farvel



GODT  NYTT  ÅR","Nyttår, Marit Irene Jensen, Dikt skrevet på 2000-tallet, Alle dikt alfabetisk",0,2000
Slående hjerte,"En rytmisk pust

Et slående hjerte

En varm kropp, og en vakker melodi

Åndedrag fra en annen varm kropp

krøllet tett inntil den første

Lyden av harmoni

og et til hjerte

slående for det andre til evig tid","Malicia33, Alle dikt alfabetisk, Dikt skrevet på 2000-tallet, Kjærlighet",1,2000
Du har en gjeld,"Da de tre tårn falt i USA

og myndighetene sa det var

terrorister som gjorde det

var det ingen som kunne se

at det var de selv som gjorde det



Men sannheten kommer alltid for en dag

og selv om den ikke passer vårt velbehag

så er det best å erkjenne og innse den

enn å late som USA fortsatt er får venn



Det er rett og slett for galt å myrde

tre tusen av sine egne borgere kun for profitt

slikt viser at man virkelig er en ondskapsfull dritt

slikt er viktigere enn bare mitt og ditt



For sier ingen i fra nå

så vil vi også er hjemme få

et statskupp ingen engang ser

og når det er for sent, hjelper det ei

om vi på våre knær ber



Kanskje er det allerede for sent

er melet i posen til regjeringen er hjemme rent?

Hvorfor sier ikke de i fra

og krever at en oppklaring, 

det skal de ha?



Og media, hvor er de?

Kan NRK ha rent mel i posen 

når de ikke en gang vil ta

debatten og fortier de

som prøver å sannheten si?



Men retten til å si ifra, den vil de ta

ved å innføre kneble-lover for å tie

de som våger å si ifra



Og folket vil ikke engang se

bevisene som er så klare

at det bare nå er å le



av de som er så dumme at de tror på

den røverhistorien USA prøver å så

selv om den er helt umulig å forstå

hvis det er fakta man ser på



Hvordan kan en bygning bli til støv

fra topp til tå på under ti sekunder?

Er befolkningen bare altfor sløv?

Hvordan kan den kan godta dagens frihets-røv

og ikke innse at terrortrusselen bare er tøv?



Kanskje er det litt arrogant å si

at alle de som ikke skjønner, de

er rett og slett er dumme brød

slikt kan gjøre noen rød



Men er det ikke ganske så dumt

å ikke engang sjekke og se

på alle de bevis og fakta som finnes?

Kanskje er det greit å bare le

av de som bare nekter å innse det



Hvordan kan du være så dum og tro

at innholdet i USAs propagandaløgner er god?

For bevisene er klare som solen

World Trade Center sprengte de selv

en rakett traff Pentagon med et smell







Å i det minste sjekke, undersøke og tenke selv

er noe du faktisk står i gjeld!



Hvordan kan flertallet bare godta det de blir fortalt

uten engang å ville sjekke de enkle fakta selv?

Det er nesten så jeg synes de alle fortjener å dø

når den frie verden snart forsvinner med et smell","Øyvind Sæther, Terror, Krig, Dikt skrevet på 2000-tallet, Alle dikt alfabetisk",0,2000
En fuglevise,"Vi gikk en deilig vårdag

alléen opp og ned;

lokkende som en gåte

var det forbudne sted.



Og vestenvinden viftet,

og himlen var så blå;

i linden satt en fuglemor

og sang for sine små.



Jeg malte dikterbilder

med lekende farvespill;

to brune øyne lyste

og lo og lyttet til.



Over oss kan vi høre

hvor det tisker og ler; --

men vi, vi tok et smukt farvel,

og møttes aldri mer. --



Og når jeg ensom driver

alléen opp og ned,

så har for de fjærete småfolk

jeg aldri ro og fred.



Fru Spurv har sittet og lyttet,

mens vi troskyldig gikk,

og gjort om oss en vise,

og satt den i musik.



Den er i fuglemunne;

thi under løvets tag

hver næbbet sanger nynner om

hin lyse forårsdag.","Vår, Digte (Henrik Ibsen), Henrik Ibsen, Dikt skrevet på 1800-tallet, Alle dikt alfabetisk",0,1800
