title,poem,tags,is_love_poem,decade
Aprilaften,"Maaske er det træthet, maaske ogsaa vemod!

Hvor stride og nyløste bækkene bruste,

saa lerkerne vaaryre, solskinsberuste

mot skyglansen slynget sin dirrende trille,

der sænker nu kvelden sig mødig og stille . . .

I vassvulne hjulspor paa ødslige veie

et gjenskin kun speiles fra skyernes leie,

hvor sol gik til hvile.

                    Saa lyst er det endnu.

                    

En klang av sølvtoners sitren i luften

er dog blit igjen fra det brusende møte,

uhørlige næsten, men anende bløte,

forjættende rike for den, som kan høre.

Og høre kan hver, som i ensomhet vanker

og urofyldt kjender, hvor blodstrømmen blanker:

Der gaar som musik mellem alle de tanker,

som ikke faar blunde, men stridende stræber

i elskov at møtes som læber mot læber.



Og to, som gaar sammen, de stanser og lytter,

til fjerntfra de hører, hvor tonene drager

dem ømt mot hinanden, snart blot som de klager

i længsel, i smerte, snart svulmende tunge.

Med blomst og med blad ligger alt nu derinde,

beredt til i sjælen at rødme og skinne,

hvert blad, aa, saa nyvaatt, saa lysegrønt krøllet --



I sløv straaler Venus. Forsølvet, forsølvet er alting i aften!","Et liv i dikt, Nils Collett Vogt, Alle dikt alfabetisk, Dikt skrevet på 1900-tallet, Sommer, April",0,1900
Jule dikt,"julen,julen,julen den er her,på denne tia blir man kalde på sine tær. 

nå har sommeren godt sin vei,og alle barna gleder seg. 

gaver for de vell, men de må vente til det er blit kveld.

de spiser mat og det er mye prat. 

gå på ski så blir du bli.

oppover bakker og nedover bakker da blir mann sliten og burde ha med seg pakker.

Kalender er bra og ha for siste dag er jula.vi synger sanger og er glad om jula.

Gå rundt treet og vær glad","Alle dikt alfabetisk, Dikt skrevet på 2000-tallet, Jul",0,2000
Sit ikke,"Sit ikke i skyggen av kolde aar

og vaak over døde minder!

Spring ut, spring ut i den sterke dag,

som luer av mot, naar den rinder!



Og hvis du er rik, da er livet rikt,

da synger det dig imøte.

Thi  er livet; spring ut og la

de døde begrave de døde!



Der sløses med kræfter i vaarens storm

der favnes i unge dage,

og guder er vi, vi er guder paa jord,

som leende tramper de svake.



Vi kjender ei hai, vi kjender ei nag,

ei frygt eller daadløs anger,

og jorderik er vort skjønne hjem

og solen vor himmelske sanger.



Vor himmelske sanger, vi følger dig

til sommer og fjerne fester:

Svingende toner, som svulmer, dør

i bruset av livets orkester.","Nils Collett Vogt, Vår, Døden, Dikt skrevet på 1800-tallet, Et liv i dikt, Alle dikt alfabetisk",0,1800
Bevare våren,"Med Fremmede blikk fra eventyret 

elskeligste syn dypt på mine

med stjernene vitne i øyeblikket     

kysset du meg,

Lepper som tok pusten av meg

Følelser som våknet i meg.

Under regnet bekom vi en

 regnet blandet med dråper, dråper av lidenskap og begjær

tørst etter kjærlighet druknet jeg i DEG

der vil jeg være

DEG vil jeg ikke miste.



Med tiden mistet jeg det meste

deg vil jeg bevare¨

minnene om deg vil jeg ikke ha

HELE deg vil jeg ha.

Blomsten du ga meg 

fikk meg i våren,

VÅREN bør bli vårt liv

vinteren har jeg sett nok av

de mørke dagene har passert

uten deg vil bladene falle igjen

uten deg er deg er det snø på håret

regnet i øya 

så ikke gå 

la oss bevare våren,

og passere vinteren sammen …","Samira, Alle dikt alfabetisk, Dikt skrevet på 2000-tallet, Vår",0,2000
Ingeborg,"Ingebjørg er ein venn å ha!



Eit smil og ein latter har ho altids på lager!

Men kristen e ho ikkje. 

Untat det kan eg ikkje finne ein ting fel.



Ho er også snill.



Glad i deg, og god jui.","Alle dikt alfabetisk, Dikt skrevet på 2000-tallet, Vennskap",0,2000
Noen ganger,"Noen ganger

følses det som om

ingen liker meg



Da er verden

ikke den samme

for meg.","Alle dikt alfabetisk, Dikt skrevet på 2000-tallet, Vennskap",0,2000
Vintervise (Krag),"g nu har det sned ihele nat,

så nu er her hvidt over mark og knat,

og nu får vi føre i skov og på vei,

så kan vi få tømmeret kjørt ned fra hei,

          den sagen er grei.



Du Ane du, -- tro hvor nu skindluen er?

og hvor har vi gjemt mine vinterklær?

og lovåtterne med en tommeltot på --

forleden dag de på loftsgulvet lå,

          nu gjorde de så!



Og giv mig så endelig kaffespand med,

og stik nogle smørbrød i lommen ned.

Og hav så færdig lidt varmt til ikvæld.

          Ajjøs da, farvel!



Hoja! Det såmæn nokså bra,

at komme sig lidegran hjemmefra.

Jeg tror det er reneste helsebod, når

det fryster så farligt, at rimfrosten står

          i skjæg og i hår.



Ja det er så snodigt slig midtvinters da,

en blir så besynderilg sjælegla'.

Og solen skinner velsignet ned,

og dombjælden synger det bedste den ved,

          og jeg synger med.","Vinter, Vestlandsviser, Vilhelm Krag, Dikt skrevet på 1800-tallet, Alle dikt alfabetisk",0,1800
Ene,"Jeg havde ild nok, da jeg var ung,

     - ild nok, -





     et blåtoppet luehav,

     ideer, ideer,

     gjæring og fødsel,

     brusen og smelten!





Da jeg var ung!





     - Noget, som tabtes,

     noget, som ei fandtes,

     håb, som brast,

     ild, som sluktes . . .





Der arbeider sig frem her inat

hos en forpint mand,

i en jaget sjæl,

ord.





     Ord . . .





Mit liv er ord.

(Og det er skade.)

Visne ord.

Stivnede hjerteslag.





     Hjerteslag!





     Gud!

     Du, som er jeget i livsfylden!





     Gud,

     du, som skaber!

     - smerter!

     kimer,

     ord -





     du -

     hvem jeg tænker mig lig os,

     men dit ansigt klart,

     din pande lys -





     du -

     hvis menneskenavn

     ensomheden

     atter og atter

     om mig hvisker,

     vifter og hvisker,

     med ukjendte stemmer nynner,

     - dette forpinte menneske,

     som blot, blot, blot

     har ord -

     husker du det da?





              *





     Nu brænder lyset ned i stagen,

     nu vandrer mørkets ånder

          på spidse tær

          ind i mit rum.





     Lysner der linjer

     der borte i krogen?





     Var det mørket, som hvisked

     om kvindelinjer,

     hvide og runde?





     Hulker der hjerter

     der borte i krogen?





     Er det ånder, som sukker?

     om død, og om nat?





     Hjerteslag . . . .





          Den,

          hvem dødsdronningen

          har udkåret,

          den,

          hvem dødsdronningen

          elsker,

          han

          er ene.





          Den,

          hvem dødsdronningen,

          når på jord

          er nat,

          men det i himlens lydfyldte hvælving

          er dag,

          er blændende, himmelsk dag,





          den,

          hvem dødsdronningen

          har da betegnet,

          dødsdronningen, dødsdronningen,

          han

          er ved jorddag ene.","Dikte (Sigbjørn Obstfelder), Sigbjørn Obstfelder, Dikt skrevet på 1800-tallet, Alle dikt alfabetisk, Ungdom",0,1800
Presser Druen! Glasset fyld!,"Presser Druen! Glasset fyld!

  Ak! hvad nytter det at klage?

  Nyd, med Haabets Glands forgyldt,

  dine sparsomt givne Dage!

  :|  Nyd hver Glæde dig bliver sendt, :|:

  snart er hele Farcen endt!





  Skaberen bandt til Livets Rand

  trende Blomster, lige skjønne,

  som igjennem Livets Land

  Reisens Møie skulde lønne.

  :|  Pluk du dem, og bind en Krands, :|:





  Rosenrød den første er,

  liflig Fryd den Øiet yder,

  stundom den dog giftig er,

  og dens Torne Sorrig byder,

  :|  Elskov det er Blomstens Navn, :|:

  og dens Plads i Pigens Favn.





  Lilliehvid den anden er;

  Storm og Uvejr Trods den byder,

  blomstrer lige skjøn og kjær,

  Eng saavel som Mark den pryder.

  :|  Venskab ? det er Blomstens Navn, :|:

  og dens Plads i Troskabs Favn.





  Rød og hvid den tredje er,

  liver op de tvende andre,

  kold er Vennen, Pigen er

  bly og lunken uden denne.

  :|  Druen! ? det er Blomstens Navn, :|:

  og dens Plads i Glædens Favn.





  Brødre! vore Blomsters Skaal,

  den, som først sin Krands faar færdig,

  han har naaet Venskabs Maal,

  og er bedste Pige værdig.

  :|  Brødre! fletter den omkap! :|:

  men gjør Krandsen ei for knap!","Frederik Schmidt, Alkohol, Rus, Vise",0,0
Tro på under...,"Kan man unngå 

å tro på under,

når man år etter år

har sett en vår?

Ikke tro på under

når liv av døde gror?

Over alt i vår natur

er det under på Moder jord..","Turid Braathen Rygge, Alle dikt alfabetisk, Dikt skrevet på 2000-tallet, Vår",0,2000
Septembersol,"I høstens løv det knitrer,

naar vinden i det tar;

jeg tænke maa paa faner,

dem solen bleket har.



Høit kvitrer det og smelder

i morgenvindens drag.

Det er en ren og gylden,

en blank septemberdag.



Hvor nær mig alt er kommet!

Med faste linjers rad

i ro og klarhet reiser

sig aasene av bad.



Nu kjølig -- blaa de hviler.

Mig er det, som til staal

hver nervebue hærdes

og spændes mot et maal.



Frem stiger det . . . Jeg ser det,

som jeg det aldrig saa,

mens speidende en rovfugl

stolt jager i det blaa.



En kongeørn! Varmt luer

det av dens fjæderskrud:

I makt, i frihetsjubel

man sjæl sig vider ut.



Saa døds det er herhjemme,

tidt ødslig trangt og tungt --

Aa, kom her dog et sormpust,

mens end mit sind er ungt!



Ja, den som varsle kunde

en tid paany i nord

da faner kampvredt knitrer

i kongeørnens spor!","Nils Collett Vogt, September, Dikt skrevet på 1900-tallet, Sol, Et liv i dikt, Alle dikt alfabetisk",0,1900
Hva skulle jeg gjort uten deg,"Du er alt, du har alt , og du kommer altids til og være alt.

Skjønner ikkje kordan jeg kunne levd uten deg !!

Du e eneståenede og bare MIN<3

Hva skulllejeg gjort uten deg min venn du e BEST og det kommer du altids til og være 4 ever !!<3<3<3<3<3","Vennskap, Alle dikt alfabetisk, Dikt skrevet på 2000-tallet",0,2000
Julemorgen,"Jeg stod en Julemorgen, taus og ene,

Og læned Hovedet mod Kirkemuren;

Mat slog mit Hjerte, blegnet laa Naturen,

Min Taare brændte paa de kolde Stene.



Da, lig en Aandeskares Hosianna,

Frembruste Orglets Tonehav derinde,

Og Stormen gik i Kirkegaardens Linde,

Og Sneen lyste som et himmelsk Manna.



Og Stjernen saa jeg over Huset tindre,

Og gjennem Stormens Flugt og Orglets Tone

Jeg hørte Menighedens fromme Psalmer.



Da sank en stille Lindring i mit Indre,

Et vaarligt Vift af Evighedens Palmer,

Og bedende jeg stod for Herrens Trone.","Børnelege, Digte (Welhaven), Johan Sebastian Welhaven, Dikt skrevet på 1800-tallet, Alle dikt alfabetisk, Jul",0,1800
Guldkorn 0013,"Det er en trolddom paa din læbe,

der er en afgrund i dit blik,

der er i lyden af din stemme

en drøms ætheriske musik.



Der er en klarhed paa din pande,

der er et mørke i dit haar,

der er en strøm af blomsteraande

omkring Dig, hvor Du staar og gaar.



Der er en skat af evig visdom

i smilehullet paa din kind,

der er en brønd, en sundhedskilde

for alle hjerter, i dit sind.



Der er en verden i dit indre,

en sværmerisk, chaotisk vaar --

som jeg umulig kan forglemme, som jeg tilbeder og forstaar.",Guldkorn,0,0
Starten på noe fint,"Jeg vil holde rundt deg slik at du kan føle deg trygg

Jeg vil ligge i sengen din og se filmer med deg mens vi kommenterer, og egentlig ikke får med oss så mye

Jeg vil høre deg le

Jeg vil kysse deg slik at jeg kjenner det ned i tærne som jeg gjør med deg

Jeg vil ut å spise med deg hvor du er helt klar på at ikke deler mat,

men likevel lar du meg spise halve desserten din

Jeg vil se deg smile

Jeg vil holde hånden din på kino, selvom du er ukomfortabel gjør du det likevel

Jeg vil være sårbar med deg

Jeg vil at du skal være sårbar med meg

Jeg vil stryke deg i håret slik jeg liker, og tenker at det liker sikkert du også

Jeg vil bli sett slik du ser meg ved små ting du legger merke til

Jeg vil se deg

Jeg vil kysse deg på ryggen mens du ligger krøllet opp ved siden av meg

Jeg vil le med deg

Jeg vil holde dine myke hender å være i øyeblikket og tenke: Livet er egentlig ganske fint!","Stine, Alle dikt alfabetisk, Dikt skrevet på 2000-tallet, Kjærlighet",1,2000
Syttende mai,"med Løsningens Liv for de længtende Kræfter,

        med Sol, med Sang, med vaiende Flag,

        med Onnens travle Yrketid efter.

Hil dig, du Norriges syttende Mai!

jeg saa ikke Straaler saa lyse og fine

og Spirer saa friske og grønne som dine,

du signede, kjære syttende Mai.

        - Og lydt over Døgnets Larm

                skal det lyde til Hjerternes Slag

                i Nordmænds Barm,

        





        - Minder saa dyre, som Folket dem eier,

        om Fædrenes Tro paa sit Fædrelands Sag,

        om Fædrenes Kamp og Fædrenes Seier.

Hil dig, du Mindernes syttende Mai!

End tør vi vove: med Troen og Retten

at møde mod Tvilen og mod Bajonetten,

saasandt der er Sandhed i syttende Mai.

                - Og lydt over Døgnets Larm

                skal det lyde til Hjerternes Slag

                i Nordmænds Barm,

        





                Den rydded og reiste os Muren af Gruset

                ved kjærlige Hænders mandige Tag

                for videre frem at fuldbygge Huset.

Hil dig, du Fremtidens syttende Mai!

Vort Virke til Norriges Lykke og Ære

vi ved, at dets bærende Vilje maa være

af Aand og med Maal som den syttende Mai.

                - Og lydt over Døgnets Larm

                skal det lyde til Hjerternes Slag

                i Nordmænds Barm,

        





                Den har forjættet: Naar Norrige kalder,

                staar vi paa Linje i broderligt Lag,

                i Samhold og Troskab, ""til Dovre falder"".

Hil dig, du Løfternes syttende Mai!

End vil det ske, trods de skillende Kløfter,

at Norrøna-Blodet holder de Løfter,

det vigsled sit Land paa hin syttende Mai.

                - Og lydt over Døgnets Larm

                skal det lyde til Hjerternes Slag

                i Nordmænds Barm,

        





                Frihedens Arv skal af Slegterne øges,

                vernes og vogtes mod Vold og Bedrag,

                Fremtidens Baner skal merkes og søges.

Hil dig, du Kravenes syttende Mai!

- Men røgted vi Arven, og mødte vi Kravet

som de, der har ødet eller begravet,

da ve, naar vi dømmes af syttende Mai!

                - Og lydt over Døgnets Larm

                skal det lyde til Hjerternes Slag

                i Nordmænds Barm,","Jonas Lie, Digte I (Jonas Lie), Dikt skrevet på 1800-tallet, Per Sivle, 17. mai, Alle dikt alfabetisk",0,1800
Til stævnemøde,"eg tar min lyse kjole på,

i håret har jeg blomster blå,

    jeg punter mig, jeg pynter mig,

    for hvem -- det siger jeg ei.



Jeg går som til en dans hver kvæld,

jeg går og nynner for mig selv.

    Jeg skynder mig, jeg skynder mig,

    hvorhen -- det siger jeg ei.







Jeg træffer dig, jeg venter på.

Du spør, hvorfor jeg skjælver så,

    jeg siger ei, jeg siger ei,

    å Gud, at jeg elsker dig!","Kjærlighet, Vestlandsviser, Vilhelm Krag, Dikt skrevet på 1800-tallet, Alle dikt alfabetisk",1,1800
Guldkorn 0005,"Godnat! Godnat!

  Kryb under dit dækken

  med nelliker strukket, med roser besat,

  med sølvhvide blade paa bringebærhækken!

  Imorgen igjen, hvis Gud saa vil,

  vækkes du op af fuglenes spil.","Henrik Wergeland, Guldkorn, Dikt skrevet på 1800-tallet",0,1800
Å den søte juletid,"Og huset står der rent

Skal julekaker bakes

Der i de tusen hjem.

På juleverksted lager

du julepynt og stas

Og er du riktig flink og flid

Snart julegaver har.

Du skriver kort, med nisser på

Og sender hit og dit

Ja, alle sammen gleder seg

selv om julen ei bli hvit.

Men nissen kommer sikkert

Det sier alle små

I år han kommer svømmende

med dykkerbriller på.

Vi tar han inn i varmen

til juleknask og gløgg

Og er han riktig blid og snill

Han får sin julegrøt.

Så gir han fra seg gaver

til store og til små

Og sannelig så tror jeg

At vår nisse tygde skrå.

Vi tar farvel med nissen

Og kysser han god natt

I morgen kan vi kose oss

med kveldens store skatt.



GOD JUL","Marit Irene Jensen, Dikt skrevet på 2000-tallet, Alle dikt alfabetisk, Jul",0,2000
Den sorgløse evige hvile,"Sliten faller jeg om, uten kontroll over kropp eller sjel

kanskje den evige hvile gjør meg endelig hel

tanken om et rop etter hjelp mens jeg svever

forsvinner idet jeg innser at jeg ikke lever","Shaitan, Alle dikt alfabetisk, Sorg",0,0
Det ukjente,"Nydelige farger,

grønn, rød,gul og hvit 

De smelter sammen

med det grønne gresset en vakker sommer morgen 

og vakre små dråper av glittrende regn



En nydelig grønn drage kveiler

bortover veggene,

spruter ild i fantastiske farger.

Vannglasset mitt 

så kaldt, vakkert, en del av naturen

slik som meg.



Mennesker rundt meg  prater,

helt i min egen verden,

i mitt eget hode,

bryr meg ikke om dem akkurat nå.



Dette er min verden, der jeg er trygg.



er at furukvistene i taket surrer seg sammen

i en myk karamellgrøt med små sorte, brente biter i.

Tenker tilbake på det som har vært,

fortiden, den farlige såre fortiden

Den trygge gode nåtiden,



møter det ukjente, den fryktede og usikkre

fremtiden med ærefykt over hva som vil skje 



alene i min egen trygge verden,

utfordrer jeg skjebnen?","Frk Ametis, Alle dikt alfabetisk, Skjebnen",0,0
Æggedosisvise,"Jeg har et Perlehumør idag,

      som Æggedosisen ligner,

hvormed      Værtinden vort/vor Vært vores      Vennelag

      paa Festens Morgen velsigner.

Ja jeg har faaet til Sjel og Liv

en Æggedosis og den var stiv.

      Ja mit Humør,

      bedre end før,

idag min Æggedosis ligner.



Jeg er saa venlig og blid og mild

      som allerfinest Raffinade;

og jeg er fyrig og fuld af Ild,

      som den Cognak vi til maa lade;

og Æggets Styrke og raske Mod

jeg føler godt i hver Draabe Blod.

      Nu kan jeg rat

      alt til paa Nat

gaae glad imellem de Glade.



Thi vil  jeg ærlig meent,

      mit toneløse Bæger fylde,

begynde tidligt og ende seent

      med Dagens Høitid at hylde.

Held Majens herlige Frihedsværk!

Hvert Aar gid Festen bli'e mere stærk!

      Leve hver Mand,

      hvem Norges Land

sin Friheds Ære mon skylde!","Alle dikt alfabetisk, Dikt skrevet på 1800-tallet, Henrik Wergeland, Henrik Wergeland - Samlede Skrifter - 2. bind 1833-1841, 17. mai",0,1800
Natten,"Kommer du heller ikke inat, du, som jeg skal knuge

til mig, mens karlsvognen synker på himlen?

    Jeg ligger og kan ikke sove og vil ikke sove; jeg

tør ikke sove alene.

    Jeg har ild! Kvinde! Mine arme skal omslutte dig,

i mørket skal mine øine drukne i dine, mit ansigt

drages mod dit, dit legemes nærhed vil jeg føle, - at

der er en anden hos mig.

    Du må ikke sove, du må ikke noget øieblik forlade

mig, din nerve skal røre ved min, din hud, alle dine

nerver, al din hud, nei, du må ikke forlade mig, ikke

et øieblik!

    Kommer du ikke, kvinde, du den mægtige, du som

kan føde, og slynger dig om mig, med dit legemes

stråler? Nu kommer snart dagen, den vanvittige dag,

og det er for sent. Hørte jeg dine fjed? Eller var det

de fjed, som hver nat danser lydløst i min sjæl? Eller

var det de fjed, som med raslende lænker vandrer

langsomt i min ånds fængsel? Jeg brænder, de glim-

tende celler flyver i mine årer, attrår at blive liv, at

blive sjæl mod lyset!

    Jeg ligger i is. En grav er mit leie.

    Hvorfor kommer du ikke, liv, store, høie kvinde,

og tænder mit legemes tusende blus, mit blods mil-

lioner stjerner?

    Jeg hører dine skridt derude, - de nærmer sig, -

og, Gud, de bæver, ti snart kommer evighedstimen, da

du ligger ved mine fødder, frygtende, - du famler

ved døren - og - og - jeg er ikke beredt! Er jeg

beredt, o Gud, er jeg beredt? Er der den brusende fos

i mit blod, den ildvarme strøm i mine hjertekamre?

Jeg tør ikke. Dine hænder er sten, din ånde er gift. Jeg

kjender dig ikke, hvem er du? Min sjæl kjender dig

ikke. Min sjæl forstår ikke dine øine i Mørket.

    Hvem kommer? Ler i?

    De kolde dagstråler kommer listende, hånler af mine

øines bøn,

    - den vanvittige dag.

    - Hun kommer.

    Som mit eget hjertes banken, når natten dør, er

hendes trins lyd.

    Der er blot hendes, i den tause gade, hun, som

kommer til mig.

    Det var til mig, hun kom.

    Hun går ved min side. Jeg slår mit blik ned, ti

rædselen er stor i mig.

    Nu synker karlsvognen.

    Hun hæver sine øine mod mig. Hun er nonne, og

hun har sorte klæder og hvid kappe.

    Hun stanser og rækker sin hånd ud.

    Guds moders medlidenhed, jordens uendelige lidel-

ses regnbue er der i nonnens øine.

    Jordens sydende attrå, higen efter at smelte sam-

men og føde, forny sig, skabe vrimler om sig!

    Jeg føler arme lægge sig mildt om mig, hoved synke

ind til mig, læber møde min mund.

    Den lange, bundne længsels, de tugtede, rensede

drifters kys.","Natt, Digte i prosa (Sigbjørn Obstfelder), Sigbjørn Obstfelder, Dikt skrevet på 1800-tallet, Alle dikt alfabetisk",0,1800
Fisken,"Fisken sym i stim

dette var eit bra rim

Fisken i vannet

Utpå landet

Pass deg for fisken

for det er den som har svisken","Alle dikt alfabetisk, Dikt skrevet på 2000-tallet, Dyr",0,2000
Bestevenn for meg,"En bestevenn er en du kan snakke med,

snakke om alt med.

En du kan le med.

En du kan gråte med.



En bestevenn tar vare på deg,

spør om det går bra,

ser på deg med øyne ingen andre gjør.



En bestevenn er der for deg,

uansett når.

En du kan ringe på natten for å si ting.



En bestevenn er en du kan gjøre alt med.

Det finnes ikke pinlige tausheter,

bare bestevenn - stillhet.



Vet du hva?

Du er en bestevenn for meg!","Vennskap, Alle dikt alfabetisk",0,0
Løv,"Jeg saa det ivaar

       som en svulmende Knop.

Jeg saa det, da Solstraalen

       lukked det op.

Jeg saa det isommer,

       mens Maaltrosten sang.

Jeg saa det ihøst,

       da det visnende hang.

Jeg saa det idag

       som det gulnede Blad

at dale mod Jord,

       medens Høstvinden kvad.

Lad falde! Lad dækkes

       af Rimfrost og Sne!

— Lad falde, lad falde!       

       — — Det  jo ske!","Viser og kvad, Per Sivle, Dikt skrevet på 1800-tallet, Alle dikt alfabetisk, Høst",0,1800
Til en!,"Dronning, dronning

over alle hvite riker

her paa jorden,

vil du bli  rikes dronning?



Jeg har aldrig feigt mig bøiet,

aldrig sveket, aldrig løiet

og dog løiet tusen ganger

smilehullet, stralleøiet.

Her er længsler fra et hjerte

her er liljer fra et sind,

dugget bleke av dets smerte,

da min sjæl var hvit som din.



Tag mot dine blomster, dronning!","Nils Collett Vogt, Alle dikt alfabetisk, Dikt skrevet på 1800-tallet, Kjærlighet, Et liv i dikt, Blomster, Liljer",1,1800
Juninat,"ver en vårlys nat har jeg længted ud,

over land og hav, å, jeg ved ei hvor.

Vidste du, hvor hjertet var fattigt da,

medens våren svam om den vide jord!



Længtet har jeg ud, og nu ved jeg hvor,

nu da jeg dig føler, da jeg dig ser.

Og jeg lukker øiet taknemligt til,

og jeg græder ud, og jeg vil ei mer.



Hver en vårlys nat har jeg drømt en drøm

-- som en hvid konval, når den sætter knop.

Og de stod i hjertet og vented dig,

og slet ingen lukked sit bæger op.



Hver en hvid konval som i hjertet gror

springer ud inat, springer ud for dig.

Og med begge hænder jeg strør dem ned --

det blir blomsterhvidt over al din vei.","Vår, Vestlandsviser, Vilhelm Krag, Dikt skrevet på 1800-tallet, Alle dikt alfabetisk",0,1800
