title,poem,tags,is_love_poem,decade
Carl Johans død,"Stille! Kongen fantaserer . .

            Stille! Stille!

Stille, Hellebardierer,

som i Forgemakket spanke!

Mine Herrer Officerer,

stille! Lad ei Hjertet banke!

Kongens blege Læber spille;

      Perler liig af brustne Snor,

            som hentrille

            hvor de ville,

      sværme vildsomt nu Hans Ord;

            og Hans Tanker,

liig de fine Alfespind

drivende for Morgnens Vind,

mellem Jord og Himmel vanke.

      Han i Paradiis sig troer

            allerede,

      skjøndt Hans Geist i Feberhede

            flaggrer kun derudenfor.



Stille! Stille! Lad os lytte!

            Hvilke Syner

maae sig skyggehurtigt flytte

      indenfor det brustne Øie,

bag hvis Dunkle Hans Erindren

netop nu med Stjernens Tindren

friskest over Alting lyner!

      O Han smiler! . Mon Han seer

             Høie

            sig at bøie

      for de stolte Pyrenæ'r?

            Mon Han skuer

Fædrehuset, som det stod,

da som Dreng Han det forlod?

paa dets Gavl de samme Duer?

samme Ranke ved dets Dør?

            Vist Han dvæler

der derhjemme? Vist Hans Sjel er

      Barn igjen idet Han døer?



Stille! Stille! Lad os lytte!

            Hvilke Syner

maae sig skyggehurtigt flytte

      indenfor det brustne Øie!

-- over Marken spredte Fløie . .

 foran lyner . .

Rundtomkring de fjerne Høie

      Himmelen i Flamme staaer . .

            Ovenover

            Røgens Vover

      Trikoloren sig udslaaer . .

            Fremad, Brave!

Fremad! En avant, Français! . .

-- O! Han andre Syn maa see

for saa blidt et Smiil at have:

      Børn i Himlens Port maae lee

            Ham imøde;

      Rosenkvast af Morgenrøde

            sin Velgjører bringe de.



O hvad Under, om Hans Tanke

            maa forvildes

naar i slig en Sværm Han hildes?

naar Hans Øre ganske døves

af de Hjerter, som i Himlen

 imødebanke?

O hvad Under, om i Vrimlen

      Tanke, Syn og Sands forgaaer?

            om de mange

            Takkesange

      pludseligt Hans Øre slaaer?

            om de Arme,

Han har varmet, klædt og født,

Ham, de endelig har mødt,

jublende imødelarme?

      om den Graad, Han stillet har,

            Ham forblinder,

      glimrende paa Engles Kinder

            endnu mere reen og klar?



Stille! Kongen troer sig hisset . .

            Stille, Alle!

Stille! Alt til Paradiset

drømmer  sig baaren . .

Stille! Stille! Lad ei Taaren

fuld og tung til Jorden falde!

Den Ham kan tilbagekalde

      fra de Syner, som Han har.

            Se! Han smiler,

            som om spiler

      alt Han ud sit Vingepar.

            . . Tys! Han stræber

at fortælle hvad Han seer.

Tys! Hans Sjel er endnu her:

 Navn er paa hans Læber;

      det er , Han tænker paa,

            Ham, som knæler,

      Ham, hvis Mæle Smerten kvæler,

            , Han, som hulker saa . !



Stille! Kongen løfter sagte

            sine Arme,

fromt ikors paa Brystet lagte . .

Faderen sin Søn vil favne,

Ham, sin Eneste, med Varme.

Ak! de zittrende ei magte

dalende sin Kraft de savne,

      og det Favntag, som Han vil,

            i sin Dignen

            en Velsignen

      omforvandles langsomt til.

            Haanden finder

famlende sit Hvilested,

dalt paa  Hoved ned.

Paradisets Glands, som blinder

      Kongens brustne Øje alt,

            Livets Minder,

      Jord og Himmel, Alt forsvinder,

            da Hans Blik paa  faldt.



Stille! Tydeligt, men sagte,

            som naar linde

susende Skjærsommervinde

henad Græssets Toppe jagte

og i Æolsklang bortføres,

"""" fra Hans Læber høres . .

Een Gang høres det: de magte

      blege zittrende ei meer;

            og fra blegen

            Læbe vegen

      Kongens Sjel i Navnet er.

            Thi en herlig

Engel i den samme Stund

lyttede ved Kongens Mund

saa nysgjerrig og saa kjærlig,

      og da Navnet """" lød,

            Han henrykket

      fyrigt Kys paa Læben trykked.

. . Engel!  blev Kongens Død!","Henrik Wergeland, Henrik Wergeland - Samlede Skrifter - 3. bind 1842-1845, Alle dikt alfabetisk, Dikt skrevet på 1800-tallet, Døden",0,1800
Livets Pust,"Livets pust farer av gårde.



Til det ugjenkjennelige,



Vi prøver å forstå det. 

Det virker som en evig syklus.



Hvor er vi?

Hvor skal vi?



Dette liv,

vi ikke har noe erkjennelse.



Vantro.



Det kan ikke være mere innfløkt en dette…



Vi er her for å svette.","Filosofi, RaySchj, Dikt skrevet på 2000-tallet, Alle dikt alfabetisk",0,2000
Dødens entré,"Til og med døden stikker av

Når døden annkommer","Døden, Alle dikt alfabetisk, Dikt skrevet på 2000-tallet",0,2000
Julegave,"Julen er her

Du er her

Du er den julegaven jeg vil ha



Ett nytt liv,

en ny dag som du gjør meg glad.","Alle dikt alfabetisk, Dikt skrevet på 2000-tallet, Jul",0,2000
O Vaar,"O Vaar, du har skuffet mig

 Gang paa Gang.

Du loved i Lund og Li.

Jeg gav dig bestandig

 min bedste Sang,

— jeg havde ei bedre at gi.

Naar Verden sig sortnede

Aar efter Aar,

 jeg gjemte et Haab,

 og det Haab, det var: Vaar

— O Vaar, du har sveget mig

 Gang paa Gang.

Og jeg, ja, jeg gav dig

 min bedste Sang.



Jeg aabned min Sjel

 for din lokkende Røst

og ænsed ei Frostnattens Brod.



Jeg er ikke skabt

 til at haabe mod Høst;

og det er dog kanske min Lod.

Jeg kan ikke for,

at jeg stunder og tror,

 naar Solstraalen varmer,

 og Græsspiren gror.

Da er det, jeg synger

 Vaaren min Sang,

om og den har sveget mig

 Gang paa Gang.



O Vaar, du har skuffet mig

 Gang paa Gang.

— Men skuff mig dog engang endnu

Og end vil jeg kvæde

 en solrunden Sang,

og den, som faar Sangen, er du.

O Vaar, du er Livet,

o Vaar, du er Sang!

 Og om du saa skuffer mig

 Gang efter Gang,

saa synger jeg endda

 om Liv og om Vaar,

— — jeg gjør det saa gjerne,

 til kommende Aar.

         ————————","Vår, Per Sivle, En Fyrstikke, Alle dikt alfabetisk, Dikt skrevet på 1800-tallet",0,1800
Guldkorn 0019,"Jeg beder dig ikke om rosen paa dit bryst,

ei heller om en lok af dit haar;

thi rosen vil falme so blomsterne i høst,

og lokkernes glasspil forgaar.



Jeg ønsker ei heller den perletunge snor,

der snør sig som en snog om din haand;

thi vilde du mig fængsle, du kjendte vel de ord,

der bandt mig med stærkere baand.



Nei, skjænk mig en tanke, naar dagen bryder frem,

et stille suk i skumringens fred,

en taareblank perle, ifald jeg skifter hjem

og sænkes under havbølgen ned.



Thi tanker og taarer er evighedens guld,

en sjælerigdom, Herren os gav,

og aldrig kan de falme og lægges under muld,

men spire som blomster fra vor grav.","Guldkorn, Vilhelm Bergsøe",0,0
Vinterkveld,"Hvor træt jeg er i kveld! For øret ringer

en dødsens klokke som saa mange gange.

Da stanser jeg med ett. I mørket klinger

ut mot mig en av mine egne sange.



Et oplyst vindu. Indenfor en kvinde.

Jeg hører fjerntfra ordene, hun synger . . .

Min ungdoms hav, som nu for gryets vinde

i tonebølger morgengulblaa gynger!



Det strømmer mot mig fra det dødes rike.

Det aander op at taakeslørte vande.

Jeg ser igjen en liten, vaarglad pike,

og hun har drømmens glorie rundt sin pande.



Op av min ungdoms hav med smil om munden,

med skimmer av en nytændt sol i haaret,

med noget ærtende paa øienbunden

blir hun mot lyset nu av sangen baaret.



Besynderlig! Fra gatens larm at flytte

ind i en verden, hvor min sjæl har hjemme,

at staa haabløs vinternat og lytte

til klangen i min egen ungdoms stemme.



I raakoldt gufs av nat og mørketygge

jeg tnæker paa saa mangt. Jeg staar og tænker,

at her paa jroden skaper skjønhet lykke,

den eneste, som jorden ubrutt skjænker.



Saa tier sangen . . . Noe deilig tidde . . .

Fra fjorden stiger taakelurens klage . . .

Kom du, min elskte, hvem jeg engang vidde

min sang i rike, strømmesterke dage!



Glemt at det bitre og det skjebnetunge.

Det er saa mangt, som vi to har at glemme.

Ta mig i haanden! Vi blev begge unge

i varmen av en ukjendt kvindestemme.","Vinter, Et liv i dikt, Nils Collett Vogt, Alle dikt alfabetisk, Dikt skrevet på 1900-tallet",0,1900
Vårvise,"tæren sidder på skjulet

         og fløiter, så det er en lyst.

         Og katten sidder i solen

         og slikker sit hvide bryst.



I bislaget står Hans Jørgen

         og klorer sig sit hår.

         «Bevare mig, som det har tinet,

         «og det bare siden igår.







«Tænk, snaut for en uge siden

         havde vi to alen sne,

         og nu er det nærsten ikke

         en fanne på marken at se.»



Hans Jørgen ruslet til skjulet

         og haler kjærrene frem,

         kikker på hjul og på axer,

         og pudser og smører dem.



Og konen hans Ane åbner

         hvert vindu som åbnes kan,

         og storvasker alle gulve

         og strør dem med brisk og med sand.



Og linerlen tripper på tunet

         og gjør sig så lækker og fin,

         og blinker med begge øine,

         og vipper med halen sin.","Vår, Vestlandsviser, Vilhelm Krag, Dikt skrevet på 1800-tallet, Alle dikt alfabetisk",0,1800
Når hverdagen blir sår og vond,"Det er sårt og vondt langt inn i sjela

kropp og sinn verker som besatt

Sjokk og vanntro bytter plass med

Pinefulle tårer på mitt kinn og jeg hvisker

kom tilbake, min store, lille venn

Du vil alltid være elsket og ønsket her igjen.

Sjokket blekner nok med tiden

og hverdagen bli grå

Men i mitt hjerte banker det

en nerve for de små","Sorg, Marit Irene Jensen, Dikt skrevet på 2000-tallet, Alle dikt alfabetisk",0,2000
Følelser,"Et smil, et blikk, et sug i magen, en sitring i kroppen.

Merkelig å føle så sterkt, for noen man ikke kjenner.

En umiddelbar kontakt, fra første øyekast. 

Ømhet og glede, men samtidig fortvilelse.

Føler han det samme? Han hører til en annen…","Kjærlighet, Følelser, Dikt skrevet på 2000-tallet, Alle dikt alfabetisk",1,2000
Norsk landskap,"Paa høstsiden er det, en vaaknende morgen

ind under en graasløret, lutende himmel,

da grætne og søvnbleke taakerne letter

og syner et landskap, som regner har bløtet,

som stormen har ødet, et endeløst landskap

med langstrakte vidder og bundløse myrer

og tunge, tungsindige, grublende fjeldvand.

Saa trøstesløst ensomt i dæmringens halvlys,

saa motstandsløst herjet og ribbet og plyndret

og derpaa lagt veirbart til bytte for stormens

og skyenes luner, slik synes en livet,

som vidderne lever. Hvem fatter saa tanken,

at høifjeldets sommer, den luftklare, korte,

nys steg over lyngen med solblanke dager,

med vrinsken og bjeldeklang, kauen og ljomen

og aandet sit skjælvende vemod paa natten?

Forlængst er den borte. Den skræmtes fra vettet

en nat, da det stormet; og nu raader høsten

langs fjeldenes sider, hvor vandene styrer,

paa bundløse myrer, hvor trollene trasker

og øver sin styrke i bækken, som stuper

sig durende frem over heier og urer

og rykker og sliter i vidjenes grener

og slæper dem med sig, saa langt som de orker

og tumler i avgrunden . . .



Høit over det store, fortvilde landskap

sig løfter en ørn. Med de rovsyke blikke

taar maal den av viddernes, fjeldenes vildhet

og kjender sig hjemme. Og som den nu seiler

i fribaaren flukt over sluk, over tinder,

stumt skuende ned paa de raadløse vidder,

stanser og skriker den:



Ørnemor, ørnemor, kommet er høsten!

Liklagt er sommeren, stormet dens stilhet.

Hjemmelig er her nu, uhygge, vildhet.

Hør det paa røsten!","Høst, Et liv i dikt, Nils Collett Vogt, Alle dikt alfabetisk, Dikt skrevet på 1800-tallet",0,1800
Den syttende mai,"Mai  af Tidens Bølger randt;

skjøn over Nord -- den Himmelen lod smile,

da Kjæmpen vaagnede af Seclers tunge Hvile,

fra aabnet Øie mørke Taage svandt.

      Skjøndt ei for at skue

      Skjoldenes Glands,

      ei Sværdenes Lue,

      Einheriars Dands,

      men Frihedens Krands

      om Tempelets Bue,

og Hakonarætens den herlige Krone,

som straalende steg af Fortidens Grav --

da Jernseclers smuldrede Liiglagen faldt --

liig Solen, der stevner fra rolige Hav,

for favne en Kongehelts Isse, som kaldt

af Folket, besteg vor fædrene Throne.



O ædle Konning! stedse Normand var

et kraftfuldt Træe, hvis Frugt var Dyder høie:

et trofast Hjerte altid Barmen bar

og Ærligheden lysed' i hans Øie:

Hans Ahner blinke høit paa Sagas Skjold:



-- O! naar jeg Oldgudindens Teppe hæver

og skuer Heltefærd paa Gimlevold

og Kongeskygger -- da mit Hjerte bæver

af Fryd. Med Ret han sig ophøiet troer

-- hans Hæder end paa Bautastene groer!



Men -- hæver Fortid Tanken i hans Sind

og føler han de gamle Skjaldres Toner

liig Bølgers Brusen, Storm om Klippetind

og Skyers Kamp trindt hiin Horneel hist throner:

end høiere sit Hoved hæve han

ved Norge  ved Norges Carl Johan!



Din lyse Oltid sank i Seclers Nat.

Ei sandt, Dig lysted' sove gamle Kjæmpe?

en Vaabenhvile? -- Helten nedsank brat;

men Sjælens Ild kan Søvnen lang ei dæmpe.

Et Ydunsæble rakte Tiden hen;

Du bed i det og reiste Dig igjen.



Hadet smelter for Frihedens Ild:

et Had, som Dankonger bygged'.

Dog aldrig Norgubbens Øienbryn skygged'

en Gnist, som ei vise han vil.

      Grundet paa Ælde,

      kan kun  fælde

      det Had, som  vilde svinge,

      evigt fra Kjølen sin Vinge.



En Staalmuur det være,

Som Norges Frihed beskytte!

Beundrende Folkene lytte

skal efter hvad Saga mon lære

med Sorg eller Smilen i  Tider

om Norge og Frihedens Død eller Liv.



-- O Saga! Alvorlige! skriv,

mens Taarer ad Kinden nedglider:

""Som Saragossa faldt Nor!

Messeniens Skjæbne

Norge ei fristed!

Men Sønner af Nor,

af Frihedsild grebne,

fra Forglemmelsen vristed'

Dit evige Navn!""

      Saa lyde din Gravsang herlige Stavn!

      O vil Du for Frihed ei døe?

      En Yngling for elskede Møe

      jo gjerne vil døe!



Og siig hvilken Møe er saa yndig og skjøn

som Friheden, Norriges Brud?

Til den er jo viet hver Norriges Søn.

Os ene gav Gud

den Møe, hvortil Verdner fra Oltiden beiled',

for hvem jo en Cato og Winkelried segned'

og Helten Riego i Dødens Arm blegned'.



      I Normænd! for bevare Bruden reen:

      Lad  være hendes Jomfrubelte!

      og hun skal blive huld, som da hun treen

      fra Himlen ned blandt Norges gjæve Helte.



Lad Glæden tænde sin Fakkel i Alterets Lue

og svinge den høit over Norge,

under de høie Arcader,

Fjeldenes snedækte Borge!

Skue hist de dandsende Rader

under Tempelets Bue,

hvor Kongen, ophøiet mild,

hædrer og elsker Normandens Ild!

staaer blandt ærværdige Gamle,

de ædle og gladstemte Normænd,

og Smaabørn ved Mødrenes Barm,

som efter Konningen famle

med spæde, udstrakte Arm.

Konge! trin hen

til Frihedens Altar i Granernes Skov!

Hvor Maien ryster de duftende Lokker,

hvor Dig Normænd omslynge

-- en Borg, som ei Ulykke rokker --

Hør! hvor de synge

din og Selvstændigheds Lov.



      Hvilken Niding tør Kredsen sig nærme?

       -- den Kreds, ærværdig ved Oldingers Sølvhaar

      og sød ved de Norges yndige Qvinder

      og Ynglingers Blik og de blussende Kinder:

      denne Kreds om Altret, som staaer

      i Lunden, som Normænd beskjærme?

      Ha! hvem tør male misundeligt Had?

      og skelende Mistro

      imellem Konge og Folk?

Gid Normannakonge du sad

her mellem de smilende Mødre,

i Mændenes kraftfulde Boe!

-- her er Ærlighed Tolk

og alle er Brødre!



      I Normænd! føle denne Glædens Dag,

      skjøn som den Elsktes Smiil

      og yndig som Minstrellens Harpeslag

      i Birkelund om Heltefædres Høie.

      For Norge lys -- som Solens aabne Øie

      for Kloder, høit paa Himmelteltets Blaae

      for evig funkler --  evig staae!

      Gid Ingen kunde sige saa:

      ""Dog ha! hvi jubler da ei Norge ud

      sin Fryd, en Høisang hæver op til Gud,

      som over Norges Fjelde evig throner?

       -- hvi bæve ikke  af Jubeltoner?""



      Men jubler Fryd paa denne skjønne Dag!

      Held Fædreland! dets raske Sønner Held!

      Af Foraarsluftens rene, klare Væld

      din Skaal, mit Land i hvert et Aandedrag!","Henrik Wergeland, Henrik Wergeland - Samlede Skrifter - 1. bind 1825-1833, Alle dikt alfabetisk, Dikt skrevet på 1800-tallet, 17. mai",0,1800
Samtale,"i sad og talte sammen

               vi to.

Udenfor blunded den hvide vinter,

rundt om os hvilte den tause verden.

Sent paa natten og stille.

Kun maaneskinslampen var tændt.



Om alt vidunderligt

blaanende, svimlende

hvisked vor stemme.

Om majsol og elskov

i det fremmede, --

ja, om afteners fryd og om morgeners glæde

talte vi to,

vi, som sad sammen

ved nat i sorg.



Da blev mit hjerte saa tungt.

Jeg stod op og strøg mig over mit hvoed,

trykkede din haand og smilte.

Gik og slog døren ilaas.","Kjærlighet, Nye Digte (Vilhelm Krag), Vilhelm Krag, Dikt skrevet på 1800-tallet, Alle dikt alfabetisk",1,1800
Naturen vår den skjønne,"Naturen vår den skjønne

der ute i det grønne

er alt nå farget hvitt

og alt er ditt og mitt.



Vi måker sne, og ber

Gud, ikke slipp ned mer

Nå vil vi ha litt vår

på stiene vi går.



Og etter våren kommer

en masse sol og sommer

vi lengter alle dit

til våres paradis.



Så kjære vår natur

la oss få gå vår tur

Langs sand og strand og sol

ikke kaldt som langt mot Nord.","Natur, Marit Irene Jensen, Dikt skrevet på 2000-tallet, Alle dikt alfabetisk",0,2000
Amors Piler,"Amors piler slo på tromme

Kjærlighetens prøve kom

Våre veier ble så krysset

Og vi knyttet andre bånd.



Amors piler lå i dvale

Men jeg tenkte ofte på

Hva hun gjorde denne jenta

Gjennom 40 lange år.



Amor spiller nå på fløyte

Og tar hele korpset med

Når til sommeren vi skal treffes

Håper jeg at det vil skje.



Amors piler jeg vil slippe løs

Jeg elsker deg min venn

Og håper at du rammes hardt

Og gir meg litt igjen","Kjærlighet, Marit Irene Jensen, Dikt skrevet på 2000-tallet, Alle dikt alfabetisk",1,2000
Du er enestående,"Du er enestående.

Du er mer verd enn noen kan måle.

Du kan noe som er spesielt for deg.

Du har noe å gi andre.

Du har gjort noe du kan være stolt av.

Du har store ubrukte ressurser.

Du duger til noe.

Du kan godta andre.

Du har evne til å forstå og lære av andre.

Det er noen som er glad i deg.","Alle dikt alfabetisk, Dikt skrevet på 2000-tallet, Erling Førland, Vennskap",0,2000
Det gode liv,"Han fotograferer i makro

Lyset, skarpheten, den rette synsvinkel, fargenes valør

Insektene, fuglene er -



Dog om hans eget bilde, liv og historie gir skygger 

som aldri kan hviskes ut, kan  foredle det som er

og søke det gode i det som kommer","Liv, LaLoba, Alle dikt alfabetisk, Dikt skrevet på 2000-tallet",0,2000
Hvordan det er gaaet til,"Vredens Søn Smerte

   Grusom steg ned

 Og i hvert Hierte

   Saaede sin Sæd.

  

 Klager og Bønner

   Iilede ud

 Fra Jordens Sønner

   Til Jordens Gud.

  

 Skaberen hørte

   Skabningens Graad,

 Taarer ham rørte,

   Han udfandt Raad.

  

 Elskov og Glæde

   Jorden han gav,

 Og dem, som græde,

   Druen han gav.

  

 Haabet med Druer

   Spirede frem,

 Og Elskovs Luer

   Tændtes ved dem.

  

 Daaren begræde

   Livet og sig,

 Elskov og Glæde

   Vier jeg mig.","Jens Zetlitz, Dikt skrevet på 1800-tallet, Alle dikt alfabetisk, Kjærlighet",1,1800
Vinter,"Løfter ansiktet mot himmelen,

lar tungen smake snø.

Lukte vinter,iskald jord,ser blomstene dø.

Kjenner vinden stryke kinnet mitt,hardt og ganske fort.

Hører stemmen til Kong vinter frese:

Sommer du skal bort!



Løfter ansiktet mot himmel,

kjenner føttene mot jord!

Danser rundt i visshet:

Jeg er liten men dog stor!

Et øyeblikk så levende,

Så inderlig godt!

Roper høyt av glede:

Takk for livet jeg har fått!



Løfter hendene mot himmel,

Jeg vil gråte ,jeg vil le.

For en gave livet gir 

når man får evnen til å se.","Vinter, Katrine, Alle dikt alfabetisk, Dikt skrevet på 2000-tallet",0,2000
Guldkorn 0020,"Lad dig sige, lad dig sige,

før det er forsent.

Kunstens underfulde rige

blev dig ei forment;

men for did at sige op,

høit mod bjergets solskinstop

maa du hige, maa du stige

med et hjerte rent.



Glemme maa du dalens kunster,

kunsten er kun en,

kløve maa du kløftens dunster,

fly for laurens gren.



jordens gunst har ingen lykke:

stjernen er dit pandesmykke,

strid! er gangen tidlig, sen,

aldrig se tilbage.



Du skal stræbe, du skal hige

med et hjerte rent

alle tanker dybe, rige

i din sjæl forent.



Hundekunster gjælder ei,

kunsten gaar en kongevei:

lad dig sige, lad dig sige.

før det er forsent.","Guldkorn, Holger Drachmann",0,0
TILBEDELSE,"Hvordan er det mulig å tilbe et menneske?

 Det er gudene som fortjener en slik opphøyelse

 Ikke et menneske med feil og mangler



 Kan ikke motstå å forgude deg

 for den du er for meg

 for den kjærlighet jeg fylles med

 når jeg ser inn i sjelen din

 det korte sekund du lar meg se



 Muren din er høy

 men min forgudelse tåler det

 jeg vil slippe inn

 en gang..","Sunflower, Alle dikt alfabetisk, Kjærlighet, Dikt skrevet på 2000-tallet",1,2000
Knuste Drømmer,"Hun sitter i glasshus,

med krystallklare tanker

visjoner om lykke,

en drøm falt i grus.

Å slipe diamanten til livets smykke

tar tid, og hun trenger den hjelpen hun får

Hun kjemper en kamp

mellom fortid og fremtid

der fortiden preger

den fremtid hun får.

Et glasshus med

sprekker og skjøre vegger

drømmen om lykke

er nå blitt knust.","Marit Irene Jensen, Lykke, Dikt skrevet på 2000-tallet, Sorg, Alle dikt alfabetisk",0,2000
Til vår unge engel,"Varme og kjærlighet du ga oss, 

Helle ditt korte liv.

Selv med mye smerte, 

du alltid hadde et smil.



Vi deg alltid vil savne, 

Du som var så god og snill.

Den vonde kampen har du kjempet, 

den du tapte, 

og nå du fortjener en hvil.



Vår kjære lille engel ... år du ble,

Ikke bare gode minner(tennåring du var), 

får hvilken kjærlighet er vel det?

Men vi tar vare på minnene som du ga,



Kjærligheten til deg er sterk,

Hvil i fred vår kjære....","Døden, Ungdom, Begravelse, EMA, Engler, Minner, Savn, Kjærlighet, Dikt skrevet på 2000-tallet, Sorg, Alle dikt alfabetisk",1,2000
Høstsang,"Vingede Skarer

Fly de sorte Skove.

Under dem farer

Storm paa vildest Vove;

Over dem blinker

Stjernen mildt, og vinker

Toget til Palmernes Ly.



Ak, om jeg kunde

Følge Fuglens Baner,

Vilde jeg blunde

Dog blandt mørke Graner;

Hist i det Fjerne

Vinker ingen Stjerne

Saa sødt som Drømmene her.



Hør, hvor min Glæde

Klang fra alle Dale,

Her, hvor min spæde

Blomst er lagt i Dvale,

Her vil jeg sprede

Om min dunkle Rede

Vingen, og vente min Blund.



I mine Drømme

Gror der Liljer fagre,

Der ser jeg ømme

Foraars-Alfer flagre;

Af mine Grave

Danne de en Have,

Vække mig smilende der.","Høst, Sang, Foraarsdigte, Digte (Welhaven), Johan Sebastian Welhaven, Dikt skrevet på 1800-tallet, Alle dikt alfabetisk",0,1800
Til Deg fra Meg,"Til Deg fra Meg.



Jeg vil alltid få kunne se deg, kanskje få det smilet du bruker å gi meg.

Det får meg til å føle et slikt savn, får meg til å lengte inn i din favn.

 

Alltid når jeg finner èn og blir kjær, oppdager jeg det er Deg jeg vil være nær.

Hvorfor kom du inn i livet mitt slik, når du hele tiden bare viser meg svik?

 

Jeg får bestandig problemer med å være ærlig, når du skal være så fordømt herlig!

Er det kjærlighet du prøver å vise? Hele tanken får meg til å ville glise.

 

Men som du sa, at jeg tilhører ikke deg, er ikke din.

Men hadde jeg turt skulle du blitt min..","Maria L. K Karlsen, Kjærlighet, Alle dikt alfabetisk, Dikt skrevet på 2000-tallet",1,2000
