title,poem,tags,is_love_poem,decade
Glommens 17de mais-qvæde,"Skjøn- hun holder i krandset Haand

      et trefarvet Vimpelbaand:

Paa  Strand det vajed

      om nyplantet Frihedsvaand.

Men bredarmet 

      til -flom

en -Furustok bær'.

      Hiin Bendel dertil

      han fæste vil,

og reise Norbann'ret 



Naar Maibanner vajer i -flom,

      da stimle skal Folket om,

og lære: kun Folkets Styrke

      kan værne dets Helligdom;

      at Arme der vil,

      og Hærder til,

      af skinnende Muskler en Foss,

      hvis opløftes skal

      den Lov over Dal,

      den Frihedens Ark blandt Os.



Som  farer -- i stærken Arm

      den leger med Harpekarm.

Hvad Godt der i Norge hændes

      Han synger af fulden Barm.

      Han synger hvordan

      Kong 

      tveeggede Brodersværd brød;

      at Kongernes Far

      til Fattigmand skar

      saamangen en Skive Brød.



Opstegen til  nær Himlens Sky,

      Han øiner om  By

Storhavet funkle under

      Kjær-Syttendemajens Gry.

      Da blegner han brat.

      Han føler, at

      en Guddom ham fører tilgravs.

      Den hvirvler ham nu

      med Sarp-Halelu

      til Frihed, til Død, tilhavs.



-- Kom Normand, og sæt dig paa Borge-skrænt

      og mærk i din Sjel paa Prent

det Qvad, som bruser under

      paa Harpen af Almagt spændt!

      hvor rungende 

      den Strengeflom,

      lovsynger den tvekronte 

      som agtede 

      den Løve, for stor

      at tøiles af Gøthajarl!



Bekrandser med  Egeflor

      det  Underchor,

som synger Borgerkongen

      saa mandige Æresord:

      ""Hil være dig Drot!

      Du sidder godt.

      Thi Maifolket bærer dig nu.

      Dig  og 

      er Stallare to:

      De æres i Nord som Du.""



Se derfor sig reiser den Furu, som

      hidførtes af stærke Glom,

og som den milde Vorma

      bandt trefarvet Bendel om,

      paa Frihedens Dag

      til Æresflag

      for Dig i den rungende Foss!

      Den skummer tilgravs

      hver Nidding, tilhavs,

      som krøb mellem Dig og Os.","Henrik Wergeland, Henrik Wergeland - Samlede Skrifter - 1. bind 1825-1833, Alle dikt alfabetisk, Dikt skrevet på 1800-tallet, 17. mai",0,1800
Sommeren.,"En vinter en vår, jeg lengtet så sårt.

 Etter deg min kjære venn, etter

 sommeren. Ditt smil, ditt flagrende hår.

 Du duggfriske sommer min elskede,

 Evig tapt er du for meg. Gud fri min sjel

 fra din magiske lenke av kjærlighet.","Vektor, Alle dikt alfabetisk, Dikt skrevet på 2000-tallet, Sommer",0,2000
En Sommerdrøm,"En Vandrer hvilte i Skyggen

Af duftende Heggetræ'r;

Ved Summen af Humlen og Myggen

Han søvned og drømte der.



Han syntes, han gik ad Skovens

Omskyggede, bugtede Sti,

Og lytted til Kildevovens

Og Droslernes Melodi.



Og mellem de gamle Stammer,

Og under det høie Krat,

Der hvælved sig mangt et Kammer,

Der ruged en halvklar Nat.



Men Blade og unge Stilke

Og Blomster paa Urt og Gren,

De glindsed som spunden Silke,

Og straaled som Ædelsten.



Libeller og Papilioner

Med Vinger af Morgenskjær,

De flagred om Skovens Kroner

Og over Konvallers Hær.



Og Fiskene smutted trygge

Og vevre i deres Bæk,

Og svam i den kjøle Skygge,

Hvor Vidjen slog ud sin Hæk.



Og Vandreren faldt i Tanker,

Og gik med bevæget Sind,

Og Blomster og lyse Ranker,

De kyssed hans røde Kind.



Men alt som han fremad vandred,

Han tabte den sikre Sti,

Og Skoven stod flux forandret,

Som bunden Kogleri.



Her turde ei Triller klinge

Bag Træernes tætte Skjul,

Her rørte sig ingen Vinge,

Ei Zefyr, ei Sommerfugl.



Her hvilede Skovens Kilde

Blandt Blomsterne, taus og klar,

Og Fiskene stode stille,

Som under et slebet Glar.



Og Vexternes tause Rige

Laa drømmende, svøbt i Duft;

Det var som man saa den stige

I Sommerens varme Luft.



Men pludseligt lød der Toner

Saa sagte som Alfesang;

Det klang gjennem Skovens Kroner,

Den deilige Kilde klang.



Fra Vedbendens lange Lokker

Det lød som et Strengespil,

Og Blomster med Kalke og Klokker,

De klingede svagt dertil.



Og hist paa den grønne Slette,

I Skovens dæmrende Hal,

Der rørte sig Fødder lette,

Der holdtes et luftigt Bal.



De blussende, ranke Dryader

Var samlede der i Flok,

Og dandsed i Klynger og Rader

Med flagrende, skinnende Lok.



De dandsed i lette Ringe

Som Voven, der slaar mod Strand,

De dandsed som Vindens Vinge,

Der bøier en Vidjevand.



De dandsed mod Skovens Kilde,

Hvor Vandreren henrykt laa;

De bøied sig glade, milde,

Og dybt i hans Øine saa.



De plukked ved Kilderanden

Hyperikum ungt og purt;

De slyngede ham om Panden

Den kraftige, friske Urt.



Af Irisen og Narcissen

De samlede Duggens Bad,

Og heldte ham over Issen

Dens Væld af et Skreppeblad.



Og Duggen, der kjøligt trilled,

Den kraftige, friske Krands,

De klared hvert Tankens Billed,

Og lutrede hver en Sands.



Han syntes, han kunde tømme

Af Planterne Livsens Saft;

Han syntes, han kunde svømme

I Luften med Ørnens Kraft.



Da vinked de lette Dryader;

Da gik han fra Kildens Bred.

Og vandred i deres Rader

Med friere, svævende Fjed.



Hvor Dagslys som Stjerner tindre

I Løvtaget klart og blidt,

I Urskovens tause Indre

De standsede deres Skridt.



Alvorlig og høi og stille

Stod Hæren af Kæmpetræ'r;

Det var som man maatte spilde

Dens Ro ved at aande her.



Her groede store Planter

Med selsomme, stærke Skud,

Med taggede, skarpe Kanter

Og glindsende, dunkel Hud.



Og Træer og grønne Buske,

De blussede underbart

Med Frugter og Blomsterduske

Af svulmende Kæmpe-Art.



I Ly af Jasminers Hække

Den studsende Vandrer laa,

Og under ham var et Dække,

Brodert med Violer smaa.



Her smuttede Nymfernes Klynge

Bag Blomsters og Rankers Flor;

Da hørte han Skoven synge,

Og fattede hvert et Ord.



Det lød ei som Sus af Vinden,

Det var ingen sagte Klang,

Det hørtes, med Stigen og Svinden,

Som mægtige Strubers Sang:



— ""Velkommen i Skovens Haller,

Du salige Menneskesjel!

Hør, Vexternes Stemme kalder, —

O, lyt til vort Kvad og dvæl!



En nagende Smerte huser

Hvert spirende Planteliv;

Den røbes, naar Egen suser,

Den hvisker fra hvert et Siv.



En kvælende Vellyst brænder

Igjennem vor Livsens Saft,

Naar Solen sin straale sender

Med manende, rastløs Kraft.



Den dybeste Jordens Længsel

Vil gjennem vor Aare gaa,

Og sprænge sit dunkle Fængsel,

Og svales af Himlens Blaa.



Den gjærer og syder og higer

Og svulmer i Plantens Skjød;

I Blomsternes Kalke stiger

Den mægtige Længsels-Glød.



Men ak, naar den Solen møder,

Da zitrer, da vaander den sig;

Vor Pragt, der blinker og gløder,

Ligner et angstfuldt Skrig.



O, kunde vor Higen sprænge

De vældige Straalers Aag,

Der vil vore Sukke trænge

Igjen under Jordens Laag!



O, kunde vort Øie tindre,

Naar Stjernerne glide frem, —

O, kunde vi dog vort Indre

Aabne for alle dem!



De hviske, naar Alt er stille,

Over den blomstrende Dal:

""Din Sol er din Længsels Kilde,

Og Kilden til al din Kval"".



Vor Taare svulmer og skjelver,

Vi ane kun Stjernens Glands;

Men Natten sig dunkel hvælver

Over vor lukkede Sands.



I Dage, der glimte fjerne,

Fra Oldtidens Straalebrud,

Fløi fra en glandsfuld Stjerne

Til Skovenes Dyb en Gud.



Ham fødte en skjøn Dryade,

Under en susende Gran,

Til Skovenes Lyst den glade,

Blussende Guddom Pan.



Hans Hjerte gjemte og næred

Med høiere, renere Glød

Den mægtige Trang, der gjæred

I Vexternes lune Skjød.



Men dybt i hans Bryst tillige

Laa der et blidere Skjær;

Det kom fra hans Faders Rige,

Den tindrende Stjernehær.



Han kunde vor Ve forklare

Med kvægende Fløitespil;

Han lærte vort Løv at svare

Med mildere Sus dertil.



Naar Solen paa vore Kroner

Fæsted sit Flammeblik,

Da svaled hans blide Toner

Vor Ild, som en kjølig Drik.



De risled i Plantens Aarer

Saa mildt som en Vaar-Regns Bad;

Da vældede glade Taarer

Frem af dens Hjerteblad.



Vi hvisked i Gudens Øre

Om fængslede Gnomers Harm,

Om Haab og om Savn, der røre

Sig lønligt i Jordens Barm.



Vi hvisked, og kunde fortælle

Om alle de Eventyr,

Der fylde hver Skovens Celle,

Naar Aftenens Straale flyr.



Da vakte han Fløitens Stemme

Saa tonerigt mangen Gang

At Malmen i Fjeldets Gjemme

Bæved derved og klang.



Og Menneskets Slægter lytted

Til Skovenes sære Røst;

Og til deres Hjerte flytted

En underlig, ukjendt Lyst.



Med Fløiter og Strengelege

De droge til Skovens Hal,

Og sad under dunkle Ege

Og prøvede Tonens Fald.



Da lærte dem Pan at gribe

I Strengen med friere Slag,

At røre den bævende Pibe

Med fuldere Aandedrag.



Om Spiren i Jordens Grube,

Ved Skabningens Moderbryst,

Han lærte den tonende Strube

At synge med klarere Røst.



Og gjennem de klingende Tanker

En duftende Aande gled;

Det var som om blomstrende Ranker

Var spændte i Strengenes Sted.



Og Vexternes Bøn blev baaren

Mod Stjernerne rent og smukt,

Og Somren var sval som Vaaren

Af alle de Toners Flugt.



Ak, nu er Skovene øde,

Forsoningens Baand er brudt;

Ved Morgen- og Aftenrøde

Vort Suk er fortabt, forskudt.



Vi saa dine Stjerneblikke,

Du salige Menneskesjel;

Velkommen, forlad os ikke,

O, lyt til vort Kvad og dvæl!



Vi lod vore Sjele stige

Af Stammernes tvingende Baand;

I Skovens dandsende Pige

Saa Du en Plantes Aand.



Vi vied ved Kildens Vove

Din Pande med Krands og Bad,

Og derfor kan Urter og Skove

Bringe Dig deres Kvad,



Og tolke Dig deres Smerte

Med bævende, susende Røst,

Og fordre af Menneskets Hjerte

Vingede Svar og Trøst.""



Saa nynnede Skoven og klaged,

Og hvilede taus paany; —

Det var et Minut, — da braged

Hvert Træ med et rædsomt Gny.



Det klang gjennem alle Lunde

Fra Skovens inderste Skjød,

Det raabte med tusind Munde:

""Den straalende Pan er død"".



Da vaktes den trætte Sover,

Men laa dog i Drømmen halv;

Et Klageskrig Egnen over

Endnu i hans Øre skjalv.","Stjerner, Maria, Digte (Welhaven), Johan Sebastian Welhaven, Dikt skrevet på 1800-tallet, Alle dikt alfabetisk",0,1800
Følelsen,"Det er tilbake,

Føles så gjennkjennelig.



Nesten en trygghet i det,

Det er så merkelig.



Samme tabbe om og om igjen,

vi fortsetter med det bemerkelig.



Eg er så lei av dette,

Det er ikke hemmelig.","Exyphia, Alle dikt alfabetisk, Dikt skrevet på 2000-tallet, Følelser",0,2000
Jeg er singel,"Rose er rød 

fioler er blå

jeg er singel

hva venter du på!!! c:","Ensomhet, Kjærlighet, Dikt skrevet på 2000-tallet, Alle dikt alfabetisk",1,2000
Høsten er bra,"høsten er bra

med mange blader blir jeg glad.

jeg kaster blader over meg hvem bryr seg.

jeg bryr meg ikke om fargene men at det

er blader gjør meg glad","Høst, Alle dikt alfabetisk, Dikt skrevet på 2000-tallet",0,2000
Leve syttende mai!,"Du qvalte Røst i Salen,

      brus frem som Fossens Væld!

Og rung igjennem Dalen

      som Storm fra Dovrefjeld,

fra alle Dølehjerter

      som under Vadmel slaae,

mens Fryds og Friheds Kjærter

      i kjække Øine staae.



See, over Storm af Latter

      (den Første vist i Aar)

den hulde Majens Datter

      rundt Norges Himmel gaaer!

Og hvor hun bliver baaren,

      den Majens favre Dag,

i Jubl hensvinder Taaren,

      som ved et Trylleslag.



Thi Meer end Guld hun øste

      vidtover Norges Land;

thi Slavejern hun løste

      af Norges gjæve Mand.

De Frie sig da fryde!

      Men Trællen sidde qvar!

Hvad rager Goth og Jyde

      Klenodet, Norge har?



Kom raske Gut og Gjente

      til Majens grønne Vold!

Vi skal Fiolen hente:

      der boer den muntre Trold,

som løser Glædens Vinger,

      som over Gubbens Haar

og Kjærringskoutet klinger:

      ""Heihopsan! det er Vaar!""



Se, Friheds Dag i Majen,

      din tro og kjække Hær!

Dit Jubelbanners Vajen

      den lyse Fjeldbirk er.

Dens muntre Grønne taler:

      ""Jeg er det skjønne Haab,

at rundt i Norges Dale

      idag er Jubelraab.""



Et Bæger skjæmmer Ingen,

      hvor Folket staaer som Brud,

med Loven -- den er Ringen --

      til Frihed vied af Gud.

 Ring i ærlig Næve

      som Lynild straaler; men,

hvis Skurken den vil hæve,

      han brænder sig paa den.



Straal da i rene Hænder,

      du Norriges Klenod!

Men slukkes du, da ender

      Stolt-Norrige i Blod:

Da aldrig meer jeg griber

      mit maiblomkrandste Glas;

men -- hui! -- paa Dovre sliber

      min gode Tollebas!","Henrik Wergeland, Henrik Wergeland - Samlede Skrifter - 1. bind 1825-1833, Alle dikt alfabetisk, Dikt skrevet på 1800-tallet, 17. mai",0,1800
Slædefart,"En aften i den glade jul

vi skulde ud at kjøre.

Paa himlen seiled som et hjul

den blanke maane, stor og gul,

der var saa deiligt føre.



Mens bedstemor blev pakket ind

fra foden op til haanden,

strøg kulden frit min røde kind,

og ret det frydede mit sind

at se min egen aanden.



Nu kaldte far, og rask jeg svang

mig baglængs op i dumpen. -

Hvor Blakken dansed, da i gang

den maatte gaa, mens bjelden klang,

til vi var over sumpen!



Men nu det lystigt strøg afsted,

saa fort som Blakken vilde.

Og langs den vide flade gled

vor sorte skygge op og ned; -

den vilde med til glide.



I maanens underlige glans,

mens vinden peb om øret,

de var, som gjærdets stør fik sans

og hopped os i luftig dans

forbi, at prøve føret.



Men da vi kom af gaden ned,

vi holdt ved husmandsstuen.

Af piben hvirvled tyk og bred

sig røgen op, og duftig gled

den bort i maaneluen.



De andre slæder kom nu til

langs fannerne ved laaven.

Saa bøied vi med munter il

til trende dombjeldkranses spil

fra sletten ind i skoven.



Der stod de lange furutrær

lig søiler smukt i rader.

Sin grønne krans de strakte hver

mod aftenhimlens straaleskjær -

et hvælv paa kolonnader.



Men da vi kom lidt længer ind,

og tæt og sort blev skoven,

gav maanen kun et sparsomt skin;

men fantasien i mit sind

blev mer og mer forvoven.



Og hver en busk fik liv og stand,

idet vi fór forbi den.

Til skjegget berserk blev en gran;

den ranke fyr var riddersmand;

hans svend stod tro ved siden.



I skyggen dybt en dødning stod,

stiv i det hvide klæde.

Han udgjød sine brødres blod,

og derfor maa den muldne fod

igjen af graven træde.



Se, ludende bag stubben gaar

en heks med stav og hætte.

Ho ho! dit væsen jeg forstaar:

Just saadan rokker, naar hun spaar,

paa hodet gamle Mette.



Og flygtigt som vort raske trav

svandt alt bag skovens fletning.

Ved bjeldens muntre klang begrav

sig ridder, dødning, heks med stav

paa flugt i modsat retning.



Men da vi kom af skoven ud

i maanens lyse lue,

da saa de blanke stjerner ud,

som skalv enhver af fryd - min Gud,

det var et deiligt skue!



Alt sprang med liv, og hjertet sprang

omkap med hele vrimlen!

Og paa den klare bjeldeklang

det let og freidig op sig svang

til stjernerne paa himlen.","Utvalgte dikt til skolebruk ved Wilh. Klem, Jul, Dikt skrevet på 1800-tallet, Vinter, Jørgen Moe, Alle dikt alfabetisk",0,1800
Dronning Gyda (Sivle),"Den unge Kong Harald

        var gjævest blandt Mænd,

dog var han ei blit

         end,

- en Høvding for Fylker,

        men ikke en Tolk

for Samlingens Mening

        og Magt i et Folk.



Da var der en Mø,

        han sig ønsked i Favn,

og 

        var hendes Navn.



Hun fostred en Tanke,

        fager og stor,

og 

        var Tanken i Ord,

- et Rige, som ikke

        var Lap bortved Lap,

men et, som var sveiset

        fra 

- et Norge, hvor Nordmænd

        alene fik raade,

og raade med 

        og ikke af Naade.



Og Tanken tændte

        i Haralds Hu

en Ild, som flammer

        i Norge endnu,

og Handlingen traadte

        i Tankens Fjed,

og Seiren, den fulgte

        signende med.



Men svarte Vetter

        la onde Raad

mod Gydas og Haarfagres

        Tanke og Daad.

Forfuskningens Nisse

        Og Splittelsens Dverg

laa rede paa Lur

        borti Hauger og Berg.

De mødtes til Virken

        ved Nat og ved Kveld

og lirked og lirker

        - desværre med Held.



Og derfor er det,

        at Norriges Sag

kræver paany

        en Hafursfjords-Dag

- ved andre Arme

        med andre Sverd,

men dog en Dag

        af det selvsamme Værd.



Og Kravet skal fyldes,

        saa visst og saa sandt

 magter at eie,

        hvad Fædrene vandt;

har Norriges Mænd

        sin Haarfagre-Marv,

har Norriges Kvinder

        fra Gyda sin Arv:

et Norge, som ikke

        er lammet og delt,

et 

        et","Per Sivle, Dronninger, Konger, Alle dikt alfabetisk, Dikt skrevet på 1800-tallet",0,1800
Paa Fjellveg,"Her gjeng eg rædd i fæle Fjell

med Hugen kvævd og sprengd.

Aa hu! Visst aldri ut eg held

aa gaa slik innestengd.



Det legg seg tungt for Barmen trong;

eg fær kje ande ut.

Eg skjelv og tenkjer Gong paa Gong:

han fell, den tunge Nut.



Det stengjer Vegg og Rygg og Kamb

for Syn og Sans og Sinn.

Den graae Bergufs skyt seg fram

og vil meg byggje inn.



Her er kje Raad, her er kje Rom,

her er kje Vind og Luft!



Men rundt i Fjelli døyvde Ljom

som Rop fraa Djuv og Kluft.



Og um fraa ville Kampe-Heid

eg fæli burt meg snur,

so stengjer paa den andre Leid

den blaae, bratte Urd.



Aa hu, so myrkt og trongt og villt!

Det kolnar meg um Kne.

Og hu, som her er audt og stilt!

Eg er som gravi ned.","Fjell, Haugtussa, Arne Garborg, Dikt skrevet på 1800-tallet, Alle dikt alfabetisk",0,1800
Din for alltid,"Jeg var din 

første

Du var min 

siste.","Korte dikt, Kjærlighet, Dikt skrevet på 2000-tallet, Alle dikt alfabetisk",1,2000
Efter skoleferien,"Hjem fra landet! . . . Mørket kommer.

Og jeg staar fortapt i porten,

glytter op mot gatenumret:

Huset heter nummer fjorten.



Matt og gra aav høstlig tungsind

luften her i gaten kjendes.

Paa den andre siden huset

alt en stille lykte tændes.



Hjem fra høie, friske himle,

sang og brus av grønne blade,

indianerlek i skoger,

saltvandslukt og saltvandsbade -



morgendugg og svalekvitter

samt et rovfuglskrik, jeg hørte

sent en julikvæld, da skyer,

vildt forrevne, maanen slørte!



Og jeg minds, hvor blodet isnet

av det vellystgys, jeg sanset.

Hvast det skar igjennem sjælen.

Ramt i hjertet da jeg stanset.



Hjem til gatens sluk fra fjeldet!

Hjem fra stjernerne og solen!

Ja, nu er jeg atter hjemme,

og imorgen er det skolen!



Dette rovfuglskrik, jeg hørte,

iltert, kaldt, var livets stemme.

Hvor det klang forhærdet hjemløst!

Ja, nu er paany jeg hjemme!



Op det trak til regn og uveir,

mens i skog jeg veiløs irret.

Urlydvildt, saa sjælen dirret,

skrek en rovfugl -



Og med dette skrik i hjertet,

indespærret, lænkebundet,

graater jeg i kval, i avmakt . . .

Nu er sommerdrømmen svundet!","Høst, Et liv i dikt, Nils Collett Vogt, Alle dikt alfabetisk, Dikt skrevet på 1900-tallet",0,1900
Nv,"Tom, tom  du er toppen

du får det til å krible i hele kroppen

du og meg på vår vei

til evig tid jeg elsker deg <3","Kjærlighet, Dikt skrevet på 2000-tallet, Alle dikt alfabetisk",1,2000
Hunden (2),"Hunden bjeffer i et sett

å være eier er ikke lett

Alltid klar for tur

det kan gjøre deg sur

Logrer med halen og er alltid glad

tisser og ødelegger alle dine blad

Aldri fred å få

hunden alltid ødelegge må

Slikker seg mellom sine ben

for å gjøre seg ren

Kommer så slikker deg i ditt ansikt

og det var slutten på dette dikt","Alle dikt alfabetisk, Dikt skrevet på 2000-tallet, Dyr",0,2000
"Entro 3,14","jeg har blodige buser

for jeg har snorta for mye

og det suser i hodet

at jeg er helt på trynet



jeg har gjengrodde lunger

hakke kjent friskluft på lenge

hvis det piper i halsen

er det et hull jeg må stenge



jeg har velvoksen lever

for jeg er tørst hele kvelden

jeg har en kropp som krever

tilførsel av vann ganske sjelden



   min verdensmaskin

   kunne trenge litt service

   den er ikke så fin

   som jeg husker fra før



   mitt tempel av kjøtt

   ser snart ikke ut mer

   det harde blir bløtt

   og det bløte sklir ut



tror jeg må ha meg et skudd","Rus, Diktsekk, Alle dikt alfabetisk, Dikt skrevet på 2000-tallet",0,2000
Velgaaende af Tønsberg,"I Mænd af ! Guds Fred Enhver!

I see Merkuren alt kommen er.

Han kommer ned fra det gamle Slot.

Han hilser Eder med Nyt og Godt.



For munter han er til at boe i Gruus.

Ind vil han i Borgerens venlige Huus.

I mindes Alle  vel:

den gjæve Kjøbmand med Konningsjel?



Bjørn Farmand var jo en Slags Merkur?

To Navne er det, men een Natur.

Saa tænk, at Bjørn er nu kommen hjem

til gamle Tønsberg, til Kongsgaard Sem.



Med Fjer paa Hatten og den paasnur

Bjørn Farmand kommer som en Merkur.

Hans Kiste er fuld af glædeligt Nyt.

I Mænd af Tønsberg, træd til og lyt!



Han bringer med sig et Glædesry

om Gjenopblomstring af Tønsbergby.

Det gamle nedsjunkne Tønsberghuus

om kort skal reise sig af sin Gruus.



Det Taarn, den Konge af Steen, paa Høj

i Luften tænder sin gyldne Fløj.

Af Glæde hopper den vilde Sjø

om Tjømøes Strande og Nøterø.



Og Hovedstaden for Agdesid

da Tønsberg bli'er som i gammel Tid.

Hvis Tønsbergtønde var viinfyldt Maal,

Han drak dets Handels og Sjøfarts Skaal.



""Som Stjerneregn over Havets Speil

sig sprede Tønsbergs Farmandsseil!""

Han drak et Vivat for Tønsberg By:

Det Gamle kommer sig nok paany.","Alle dikt alfabetisk, Dikt skrevet på 1800-tallet, Henrik Wergeland, Henrik Wergeland - Samlede Skrifter - 2. bind 1833-1841, Tønsberg",0,1800
Guldkorn 0010,"Man sætter rosenstokken hen i kulde,

  den døier ondt, saalænge vintren varer,

  men netop derved den sin kraft bevarer,

  i vaaren faar den knopper mere fulde.","Christian Winther, Guldkorn",0,0
Pappa,"Hvorfor

er du borte

Når alle sier

du er alltid med meg



I følge folk

er du her

Du ser meg med gjennomsiktige øyne

Ligger i veggene

i taket

i luften

Og omfavner meg når jeg tenker på deg



Jeg kan ikke se

dine øyne med mine øyne

Jeg kan ikke føle

ditt omfavn



Er du her likevel?","Savn, Baloo, Dikt skrevet på 2000-tallet, Sorg, Alle dikt alfabetisk",0,2000
Norges konger,"HARALD HÅRFAGRE erobret det hele riket,

småkongene måtte på jarlestol stige.



EIRIK BLODØKS ble for sin grumhet forjagt,

fikk så i England en greves makt.



HÅKON ADELSTEIN bygde først kirker opp

og vake varder på fjellets topp.



HARALD GRÅFELL lignet Eirik i sinn.

Han brente Sigurd Ladejarl inn.



HÅKON JARL av makten ble grum og hård.

Ham drepte trell Kark i Toras gård.



OLAV TRYGVASON kristnet med ild og ord.

I Svolderslaget han sprang overbord.



EIRIK og SVEIN jarler av Jadeætt,

de skiftet landet og hvermann rett.



HELLIG OLAV kristnet med blodig dåp.

Ved Stiklestad falt han for bøndernes hop.



SVEIN KNUTSSØNN, sønn av den danske Knut

ved renker kom inn og ved flukt herut.



MAGNUS DEN GODE har navnet fortjent.

Han Danmark fikk ved testament.



HARALD HÅRDRÅDE, helten berømt fra Syd,

sin bane fikk av engelske spyd.



OLAV KYRRE anla Bergen by,

hans fredsomhet ga ham velsignet ry.



MAGNUS BARFOT feidet i Vesterhav,

i irlands myrer han fant sin grav.



ØYSTEIN MAGNUSSON, kyndig i landets lov,

han satte sverdet bak bondens plog.



SIGURD JORSALSFAR kjempet i jødeland.

Hans sinn var heftig som ildebrann.



MAGNUS BLINDE, den stakkar, ble blind ført om

av slembedegn i sin kongedom.



HARALD GILLE beviste ved jernbyrd sin rett.

Han handlet ille, det gikk ham slett.



SIGURD MUNN fikk døden i mellom herder

av borgerkrigens løsslupne sverde.



INGE KROKRYGG fôr ivrig med Gregers omkring

fra valplass til valplass, fra ting til ting.



ØYSTEIN HARALDSSON, mer hissig en klok.



HÅKON HERDEBREI ligger i Steinavåg.



MAGNUS ERLINGSSON, gamle jarl stakkes sønn,

ligger begravet i Sognesjøen.



SVERRE SIGURDSSON alle fiender vog

som ville stanse hans birkebeintog.

Han kunne latin, var viet til prest.

Når verst det syntes, det gikk han best.



HÅKON SVERRESSON regjerte kun tvende år.



GUTTORM SIGURDSSON døde midt i sin vår.



INGE BÅRDSSON giver baglerne fred.

De syntes ikke å trives derved.



HÅKON HÅKONSSON - gamle - fikk krigen forbi,

nå satt Birkebein bort sine ski.

Med Baglen han talte om gamle slag.

Nå blomstret Norge i glans og mak.



MAGNUS LAGABØTER fikk lovene bedre,



EIRIK PRESTHATER kjempet mot kirkens fedre.



HÅKON MAGNUSSON styrte Norge godt,

holdt prektig hoff på Akershus Slott.



MAGNUS SMEKK alt Sverige også adlød.

I hans tid raste den svarte død.



HÅKON DEN SJETTE med danske Margrete seg giftet

som alle tre rikers forening stiftet.



OLAV HÅKONSSON døde, man vet ei hvorav.

Foreningen stiftedes over hans grav.","Dikt skrevet på 1800-tallet, Henrik Wergeland, Norge, Alle dikt alfabetisk",0,1800
